{
  "$schema": "https://json-schema.org/draft/2020-12/schema",
  "$id": "https://qifei.local/schemas/project-state.schema.json",
  "title": "Qifei Proposal V2 Project State",
  "type": "object",
  "required": [
    "schema_version",
    "project_id",
    "project_name",
    "proposal_owner",
    "created_at",
    "phase",
    "approvals",
    "chapters",
    "reopen_log"
  ],
  "properties": {
    "schema_version": {"enum": ["1.0", "1.1", "1.2", "1.3", "1.4", "1.5", "1.6", "1.7", "1.8"]},
    "project_id": {"type": "string", "minLength": 1},
    "project_name": {"type": "string", "minLength": 1},
    "proposal_owner": {"type": "string", "minLength": 1},
    "created_at": {
      "type": "string",
      "pattern": "^\\d{4}-\\d{2}-\\d{2}T\\d{2}:\\d{2}:\\d{2}"
    },
    "task_mode": {"enum": ["full_deck", "inherited_module", "standalone_module"]},
    "task_nature": {"enum": ["persuasive", "visual_showcase"]},
    "deliverable_level": {"enum": ["content", "slides", "export"]},
    "content_authority": {"enum": ["studio", "feishu", "local", "inherit_parent"]},
    "module_context": {
      "type": ["object", "null"],
      "required": [
        "module_id",
        "parent_project_id",
        "inherited_content_freeze_id",
        "inherited_design_version",
        "strategy_input",
        "module_claim",
        "strategy_output"
      ],
      "properties": {
        "module_id": {"type": "string", "minLength": 1},
        "parent_project_id": {"type": ["string", "null"]},
        "inherited_content_freeze_id": {"type": ["string", "null"]},
        "inherited_design_version": {"type": ["string", "null"]},
        "strategy_input": {"type": ["string", "null"]},
        "module_claim": {"type": ["string", "null"]},
        "strategy_output": {"type": ["string", "null"]}
      },
      "additionalProperties": false
    },
    "phase": {
      "enum": [
        "intake",
        "requirements",
        "strategy",
        "project_agents",
        "manuscript",
        "full_redteam",
        "content_frozen",
        "visual_direction",
        "visual_sample",
        "design_calibration",
        "design_system",
        "generation",
        "review",
        "speaker_notes",
        "qa",
        "export"
      ]
    },
    "content_freeze_id": {"type": ["string", "null"]},
    "design_version": {"type": ["string", "null"]},
    "proposal_draft": {"$ref": "#/$defs/proposalDraft"},
    "speaker_notes": {"$ref": "#/$defs/speakerNotes"},
    "brand_visual": {"$ref": "#/$defs/brandVisual"},
    "visual_direction": {"$ref": "#/$defs/visualDirection"},
    "design_calibration": {"$ref": "#/$defs/designCalibration"},
    "production": {"$ref": "#/$defs/production"},
    "full_redteam": {"$ref": "#/$defs/fullRedteam"},
    "assembly": {"$ref": "#/$defs/assembly"},
    "approvals": {
      "type": "object",
      "additionalProperties": {"$ref": "#/$defs/approval"}
    },
    "chapters": {
      "type": "array",
      "items": {"$ref": "#/$defs/chapter"}
    },
    "reopen_log": {
      "type": "array",
      "items": {"$ref": "#/$defs/reopenEvent"}
    },
    "runtime": {
      "type": "object",
      "properties": {
        "checked_at": {"type": "string"}, "agent_host": {"type": ["string", "null"]},
        "runtime_profile": {"type": "string"}, "gaps": {"type": "array", "items": {"type": "string"}}
      }
    },
    "runtime_decisions": {
      "type": "object",
      "additionalProperties": {
        "type": "object",
        "required": ["decision", "by", "at"],
        "properties": {"decision": {"enum": ["accepted_downgrade"]}, "by": {"type": "string"}, "at": {"type": "string"}, "note": {"type": "string"}}
      }
    },
    "validation_waivers": {
      "type": "array",
      "items": {
        "type": "object",
        "required": ["error", "reason", "record_id"],
        "properties": {"error": {"type": "string"}, "reason": {"type": "string"}, "record_id": {"type": "string"}},
        "additionalProperties": false
      }
    },
    "visual_review": {"type": "object"},
    "final_check": {"type": "object"}
  },
  "additionalProperties": false,
  "$defs": {
    "approval": {
      "type": "object",
      "required": ["approved", "by", "at", "record_id"],
      "properties": {
        "approved": {"type": "boolean"},
        "by": {"type": ["string", "null"]},
        "at": {"type": ["string", "null"]},
        "record_id": {"type": ["string", "null"]}
      },
      "additionalProperties": false
    },
    "proposalDraft": {
      "type": "object",
      "required": ["authority", "status", "format_version", "verified_slide_ids"],
      "properties": {
        "authority": {"enum": ["studio", "feishu", "local"]},
        "status": {
          "enum": ["not_started", "local_fallback_pending_sync", "editing", "verified"]
        },
        "format_version": {"type": "string"},
        "feishu_doc_url": {"type": ["string", "null"]},
        "document_id": {"type": ["string", "null"]},
        "revision_id": {"type": ["integer", "null"]},
        "last_verified_at": {"type": ["string", "null"]},
        "verified_snapshot_path": {"type": "string"},
        "verified_snapshot_sha256": {"type": ["string", "null"]},
        "verified_slide_ids": {"type": "array", "items": {"type": "string"}},
        "fallback_reason": {"type": ["string", "null"]},
        "studio_log_path": {"type": ["string", "null"]}
      },
      "additionalProperties": false
    },
    "speakerNotes": {
      "type": "object",
      "required": ["status", "local_backup_path"],
      "properties": {
        "status": {"enum": ["not_started", "draft", "verified"]},
        "final_slide_count": {"type": ["integer", "null"]},
        "final_order_hash": {"type": ["string", "null"]},
        "feishu_doc_url": {"type": ["string", "null"]},
        "local_backup_path": {"type": "string"}
      },
      "additionalProperties": false
    },
    "brandVisual": {
      "type": "object",
      "required": ["source_ids", "source_files", "audit_path"],
      "properties": {
        "scope_decision": {"type": ["string", "null"]},
        "project_brand_name": {"type": ["string", "null"]},
        "reference_brand_name": {"type": ["string", "null"]},
        "source_ids": {"type": "array", "items": {"type": "string"}},
        "source_files": {"type": "array", "items": {"type": "string"}},
        "audit_path": {"type": "string"},
        "design_incorporation_record_id": {"type": ["string", "null"]}
      },
      "additionalProperties": false
    },
    "visualDirection": {
      "type": "object",
      "required": ["directions"],
      "properties": {
        "directions": {"type": "array", "items": {"type": "object"}},
        "selected_direction_id": {"type": ["string", "null"]},
        "approval_record_id": {"type": ["string", "null"]}
      },
      "additionalProperties": false
    },
    "designCalibration": {
      "type": "object",
      "required": ["path", "profile", "required_sample_types"],
      "properties": {
        "path": {"type": "string"},
        "profile": {"enum": ["auto", "compact", "standard", "extended"]},
        "planned_slide_count": {"type": ["integer", "null"]},
        "alpha_sample_path": {"type": ["string", "null"]},
        "production_check_path": {"type": ["string", "null"]},
        "required_sample_types": {"type": "array", "items": {"type": "string"}},
        "approval_record_id": {"type": ["string", "null"]}
      },
      "additionalProperties": false
    },
    "production": {
      "type": "object",
      "required": ["mode", "max_agents", "plan_path", "status"],
      "properties": {
        "mode": {"enum": ["sequential", "parallel_after_gates"]},
        "max_agents": {"type": "integer"},
        "plan_path": {"type": "string", "minLength": 1},
        "status": {
          "enum": ["not_started", "ready", "in_flight", "awaiting_reverify", "verified", "blocked"]
        },
        "wave_id": {"type": ["string", "null"]}
      },
      "additionalProperties": false
    },
    "fullRedteam": {
      "type": "object",
      "required": ["report_path", "review_agent_id", "independent_agent"],
      "properties": {
        "report_path": {"type": "string"},
        "review_agent_id": {"type": ["string", "null"]},
        "independent_agent": {"type": "boolean"}
      },
      "additionalProperties": false
    },
    "assembly": {
      "type": "object",
      "required": ["manifest_path", "status", "ready_slide_ids"],
      "properties": {
        "manifest_path": {"type": "string"},
        "status": {"enum": ["collecting", "all_pages_confirmed", "final_approved"]},
        "ready_slide_ids": {"type": "array", "items": {"type": "string"}},
        "final_approval_record_id": {"type": ["string", "null"]}
      },
      "additionalProperties": false
    },
    "chapter": {
      "type": "object",
      "required": ["chapter_id", "slides"],
      "properties": {
        "chapter_id": {"type": "string"},
        "source_path": {"type": "string"},
        "manuscript_confirmed": {"type": "boolean"},
        "confirmation_record_id": {"type": ["string", "null"]},
        "page_confirmations": {"type": "object", "additionalProperties": {"type": "string"}},
        "pages_reopened": {"type": "array", "items": {"type": "string"}},
        "slides": {"type": "array", "items": {"type": "string"}},
        "design_loop_passed": {"type": "boolean"},
        "design_loop_report": {"type": ["string", "null"]},
        "design_loop_record_id": {"type": ["string", "null"]}
      },
      "additionalProperties": false
    },
    "reopenEvent": {
      "type": "object",
      "required": ["slide_id", "reason", "reopened_by", "reopened_at", "scope"],
      "properties": {
        "slide_id": {"type": "string", "minLength": 1},
        "reopened_at": {"type": "string", "pattern": "^\\d{4}-\\d{2}-\\d{2}T"},
        "scope": {"type": "string", "minLength": 1},
        "reason": {"type": "string"},
        "reopened_by": {"type": "string"}
      },
      "additionalProperties": false
    }
  }
}
