{
  "schema_version": "1.8",
  "project_id": "{{INIT:PROJECT_ID}}",
  "project_name": "{{INIT:PROJECT_NAME}}",
  "proposal_owner": "{{INIT:OWNER}}",
  "created_at": "{{INIT:CREATED_AT}}",
  "task_mode": "full_deck",
  "deliverable_level": "export",
  "content_authority": "feishu",
  "module_context": null,
  "phase": "intake",
  "content_freeze_id": null,
  "design_version": null,
  "proposal_draft": {
    "authority": "feishu",
    "status": "not_started",
    "format_version": "proposal-draft-v2",
    "feishu_doc_url": null,
    "document_id": null,
    "revision_id": null,
    "last_verified_at": null,
    "verified_snapshot_path": "content/feishu/proposal-draft.md",
    "verified_snapshot_sha256": null,
    "verified_slide_ids": [],
    "fallback_reason": null
  },
  "speaker_notes": {
    "status": "not_started",
    "final_slide_count": null,
    "final_order_hash": null,
    "feishu_doc_url": null,
    "local_backup_path": "content/speaker-notes.md"
  },
  "brand_visual": {
    "scope_decision": null,
    "project_brand_name": null,
    "reference_brand_name": null,
    "source_ids": [],
    "source_files": [],
    "audit_path": "evidence/brand-visual-audit.md",
    "design_incorporation_record_id": null
  },
  "visual_direction": {
    "directions": [],
    "selected_direction_id": null,
    "approval_record_id": null
  },
  "design_calibration": {
    "path": "deck/design-calibration.html",
    "profile": "auto",
    "planned_slide_count": null,
    "alpha_sample_path": null,
    "required_sample_types": [],
    "approval_record_id": null
  },
  "production": {
    "mode": "parallel_after_gates",
    "max_agents": 3,
    "plan_path": "deck/production/plan.json",
    "status": "not_started",
    "wave_id": null
  },
  "full_redteam": {
    "report_path": "reviews/redteam/FULL.json",
    "review_agent_id": null,
    "independent_agent": false
  },
  "assembly": {
    "manifest_path": "deck/assembly-ready/manifest.json",
    "status": "collecting",
    "ready_slide_ids": [],
    "final_approval_record_id": null
  },
  "approvals": {
    "materials_scope": {"approved": false, "by": null, "at": null, "record_id": null},
    "brief_grill": {"approved": false, "by": null, "at": null, "record_id": null},
    "proposal_brief": {"approved": false, "by": null, "at": null, "record_id": null},
    "requirements": {"approved": false, "by": null, "at": null, "record_id": null},
    "strategy": {"approved": false, "by": null, "at": null, "record_id": null},
    "outline": {"approved": false, "by": null, "at": null, "record_id": null},
    "project_agents": {"approved": false, "by": null, "at": null, "record_id": null},
    "full_redteam": {"approved": false, "by": null, "at": null, "record_id": null},
    "content_freeze": {"approved": false, "by": null, "at": null, "record_id": null},
    "brand_visual_sources": {"approved": false, "by": null, "at": null, "record_id": null},
    "brand_visual_audit": {"approved": false, "by": null, "at": null, "record_id": null},
    "brand_visual_incorporation": {"approved": false, "by": null, "at": null, "record_id": null},
    "visual_direction": {"approved": false, "by": null, "at": null, "record_id": null},
    "design_calibration": {"approved": false, "by": null, "at": null, "record_id": null},
    "design": {"approved": false, "by": null, "at": null, "record_id": null},
    "generation_ready": {"approved": false, "by": null, "at": null, "record_id": null},
    "design_loop": {"approved": false, "by": null, "at": null, "record_id": null},
    "final_page_order": {"approved": false, "by": null, "at": null, "record_id": null},
    "speaker_notes": {"approved": false, "by": null, "at": null, "record_id": null},
    "final_assembly": {"approved": false, "by": null, "at": null, "record_id": null}
  },
  "chapters": [],
  "reopen_log": []
}
